{
  "id": "apple_pay_partner_marketing_manager_emeia_london",
  "title": "Apple Pay Partner Marketing Manager EMEIA",
  "location": "London, England, United Kingdom",
  "company": "Apple",
  "department": "Marketing",
  "seniority": "Mid-level",
  "responsibilities": [
    "Manage strategic marketing relationships with financial partners to drive consumer education and active use of Apple Pay.",
    "Support marketing planning, creative development, review and approval of partner communications following Apple Guidelines.",
    "Drive development of Apple Pay communications in Apple-owned channels to support Wallet features related to Apple Pay.",
    "Work with Product and Business teams to define the brief and marketing plan.",
    "Educate key external partners through their channels on new and existing Wallet features.",
    "Develop and implement lifecycle marketing strategies for key EMEIA markets.",
    "Identify opportunities to incorporate Wallet features in Apple Pay campaign-based and evergreen engagement communications.",
    "Be aware of market dynamics and regulatory environment effecting payments and impact on customer experience and behaviour.",
    "Partner with regional Business stakeholders to identify trends and insights and define marketing needs."
  ],
  "must_have_requirements": [
    "Experience driving partner marketing activities and customer acquisition campaigns across different geographical territories",
    "Experience working collaboratively and building positive relationships with business partners and stakeholders",
    "Understanding of product marketing and proven ability to turn complex data into actionable insights"
  ],
  "nice_to_have_requirements": [
    "Prior experience in financial products or services",
    "Outstanding organisational skills and the ability to handle multiple projects simultaneously",
    "Excellent communication and presentation skills",
    "Customer-focused with strong attention to detail",
    "A university degree or equivalent",
    "Fluency in English. Additional European languages desirable."
  ],
  "skills": [
    {
      "name": "Marketing",
      "importance": 10,
      "years_of_experience": 3
    },
    {
      "name": "Partner Marketing",
      "importance": 9,
      "years_of_experience": 3
    },
    {
      "name": "Customer Acquisition",
      "importance": 8,
      "years_of_experience": 3
    },
    {
      "name": "Stakeholder Management",
      "importance": 7,
      "years_of_experience": 3
    },
    {
      "name": "Product Marketing",
      "importance": 7,
      "years_of_experience": 3
    },
    {
      "name": "Communication Skills",
      "importance": 6,
      "years_of_experience": 0
    },
    {
      "name": "Presentation Skills",
      "importance": 6,
      "years_of_experience": 0
    },
    {
      "name": "Financial Products",
      "importance": 4,
      "years_of_experience": 0
    }
  ],
  "tech_stack": [
    "Apple Pay"
  ],
  "years_of_experience_min": 0,
  "years_of_experience_max": 0,
  "raw_text": "Apple Pay Partner Marketing Manager EMEIA\nLondon, England, United Kingdom\nMarketing\nSummary\nApple is looking for a marketing manager to develop and support marketing programmes for Apple Pay and Apple Wallet services. The role is primarily responsible for working with financial partners to drive consumer awareness and education of Apple Pay as part of the Wallet, Payments and Commerce (WPC) EMEIA team.\n\nDescription\nManage strategic marketing relationships with financial partners to drive consumer education and active use of Apple Pay. Work with internal marketing teams to support marketing planning, creative development, review and approval of partner communications following Apple Guidelines.\n\nDrive development of Apple Pay communications in Apple-owned channels to support Wallet features related to Apple Pay. Work with Product and Business teams to define the brief and marketing plan. Work with key external partners to educate through their channels on new and existing Wallet features.\n\nWork with US-based and local Marketing teams to develop and implement lifecycle marketing strategies for key EMEIA markets and identify opportunities to incorporate Wallet features in Apple Pay campaign-based and evergreen engagement communications. \n\nBe aware of market dynamics and regulatory environment effecting payments and impact on customer experience and behaviour. Partner with regional Business stakeholders to identify trends and insights and define marketing needs.\n\nThe role will include virtual meetings across time zones and travel within EMEIA as needed.\n\nResponsibilities\nMinimum Qualifications\nExperience driving partner marketing activities and customer acquisition campaigns across different geographical territories\nExperience working collaboratively and building positive relationships with business partners and stakeholders\nUnderstanding of product marketing and proven ability to turn complex data into actionable insights\nPreferred Qualifications\nPrior experience in financial products or services\nOutstanding organisational skills and the ability to handle multiple projects simultaneously\nExcellent communication and presentation skills\nCustomer-focused with strong attention to detail\nA university degree or equivalent\nFluency in English. Additional European languages desirable."
}
