{
  "job_id": "apple_data_scientist_london",
  "company": "Apple",
  "location": "London, England, United Kingdom",
  "title": "Data Scientist - EMEIA Demand Forecasting & Analytics",
  "seniority": "Mid-level",
  "responsibilities": [
    "Manage end-to-end solution delivery.",
    "Gather business requirements.",
    "Design and build solutions.",
    "Manage testing, training, and rollout.",
    "Partner with IS&T and Business Process Reengineering teams on delivery for complex projects.",
    "Act as superusers of analytics & BI platforms (e.g. Tableau, SAP BusinessObjects), databases (e.g. Dremio, Snowflake), and data science platforms (e.g. Dataiku).",
    "Create and maintain data pipelines and machine learning solutions.",
    "Train and encourage adoption of these technologies with the wider Sales Finance team."
  ],
  "must_have_requirements": [
    "3-5 years experience working as a data scientist, data engineer, data analyst, or related role",
    "2-3 years experience in Python (with emphasis on packages like Pandas, scikit-learn, statsmodels)",
    "Proficiency in query languages such as SQL",
    "Basic knowledge and understanding of software design principles",
    "BS/MS in Data Science/Machine Learning, Mathematics, Statistics, Information Systems, or related field"
  ],
  "nice_to_have_requirements": [
    "Solid understanding of the theory behind statistical analysis and machine learning",
    "Experience in applying data science / machine learning techniques especially times series forecasting to provide solutions to real business problems",
    "Knowledge of machine learning techniques especially for time series forecasting",
    "Experience in developing and maintaining data pipelines",
    "Experience with cloud data science platforms: Dataiku (preferred), DataRobot, Databricks, AWS SageMaker, Google Cloud AI Platform, etc.",
    "Experience in full data science project delivery lifecycle - from identifying the underlying business needs to delivering projects in manner that meets those needs",
    "Curiosity to understand new data science tools and how they can be leveraged to meet business needs",
    "Ability to translate technical content for non-technical audiences and vice-versa",
    "Strong verbal / written communication skills",
    "Creativity to go beyond current tools to deliver the best solution to the problem",
    "Detail oriented and self-motivated individual able to function effectively when working independently or in a team.",
    "Familiarity with MLOps practices",
    "Experience with Git",
    "Experience using Tableau",
    "Experience using Essbase",
    "Experience using BusinessObjects"
  ],
  "skills": [
    {
      "skill": "Data Science",
      "importance": 9
    },
    {
      "skill": "Data Engineering",
      "importance": 7
    },
    {
      "skill": "Data Analysis",
      "importance": 7
    },
    {
      "skill": "Python",
      "importance": 10
    },
    {
      "skill": "Pandas",
      "importance": 9
    },
    {
      "skill": "Scikit-learn",
      "importance": 9
    },
    {
      "skill": "Statsmodels",
      "importance": 7
    },
    {
      "skill": "SQL",
      "importance": 10
    },
    {
      "skill": "Statistical Analysis",
      "importance": 7
    },
    {
      "skill": "Machine Learning",
      "importance": 9
    },
    {
      "skill": "Time Series Forecasting",
      "importance": 7
    },
    {
      "skill": "Data Pipelines",
      "importance": 7
    },
    {
      "skill": "Dataiku",
      "importance": 6
    },
    {
      "skill": "DataRobot",
      "importance": 4
    },
    {
      "skill": "Databricks",
      "importance": 4
    },
    {
      "skill": "AWS SageMaker",
      "importance": 4
    },
    {
      "skill": "Google Cloud AI Platform",
      "importance": 4
    },
    {
      "skill": "Tableau",
      "importance": 4
    },
    {
      "skill": "Essbase",
      "importance": 3
    },
    {
      "skill": "BusinessObjects",
      "importance": 3
    },
    {
      "skill": "Git",
      "importance": 3
    },
    {
      "skill": "MLOps",
      "importance": 3
    },
    {
      "skill": "Dremio",
      "importance": 4
    },
    {
      "skill": "Snowflake",
      "importance": 4
    },
    {
      "skill": "SAP BusinessObjects",
      "importance": 4
    },
    {
      "skill": "Communication Skills",
      "importance": 7
    }
  ],
  "years_of_experience": {
    "data_science": 3,
    "python": 2
  },
  "tech_stack": [
    "Python",
    "SQL",
    "Pandas",
    "Scikit-learn",
    "Tableau",
    "AWS",
    "GCP",
    "Git",
    "Snowflake",
    "SAP BusinessObjects",
    "Dremio",
    "Dataiku",
    "DataRobot",
    "Databricks"
  ],
  "experience_summary": {
    "minimum": 3,
    "maximum": 5
  },
  "raw_text": "Data Scientist - EMEIA Demand Forecasting & Analytics\nLondon, England, United Kingdom\nCorporate Functions\n\nSummary\nPosted:\n20 Nov 2025\nWeekly Hours:\n35\nRole Number:\n200630083-2114\nApple is a place where extraordinary people gather to do their best work. Together we create products and experiences people once couldn’t have imagined - and now can’t imagine living without. If you’re motivated by the idea of making a real impact, and joining a team where we pride ourselves in being one of the most diverse and inclusive companies in the world, a career with Apple might be your dream job! You will become a member of the Sales Finance team at Apple. With approximately 150 employees based across 4 regional hubs within EMEIA (Europe, Middle East, India and Africa), we create value, collaborating with many teams to provide outstanding commercial and financial support. We set the bar high; go out of our way to help others; share knowledge; filter out noise to focus on the essential; encourage the very best from ourselves and the team; and drive the right course of action. To do all of this you will be an excellent communicator, collaborator and innovator, with a passion for debate and inclusion. \n\nDescription\nOur team provides data & automation infrastructure to enable commercial insights for EMEIA Sales Finance and EMEIA Sales. In your role, you will create and maintain data pipelines and machine learning solutions.  We help to train and encourage adoption of these technologies with the wider Sales Finance team. You will work in a collaborative environment with minimal formal structure and should be comfortable in a changing environment with competing priorities. You will possess proven business insight, a strong quantitative / technical background, natural curiosity, and the ability to effectively shift between communications styles based on the audience (from a technical peer review through to a leadership update). As this is a role within Finance, you will also be required to have attention to detail as well as strong business and finance acumen. \n\nResponsibilities\nYou will manage the end-to-end solution delivery, including:\ngathering business requirements\ndesigning and building solutions,\nmanaging testing, training, and rollout\nFor more complex projects, you may partner with IS&T and Business Process Reengineering teams on delivery. Our team acts as superusers of analytics & BI platforms (e.g. Tableau, SAP BusinessObjects), databases (e.g. Dremio, Snowflake), and data science platforms (e.g. Dataiku).\nMinimum Qualifications\n3-5 yrs experience working as a data scientist, data engineer, data analyst, or related role\n2-3 years experience in Python (with emphasis on packages like Pandas, scikit-learn, statsmodels)\nProficiency in query languages such as SQL\nBasic knowledge and understanding of software design principles and how to apply them (SOLID, DRY, modularity, abstraction, consistency, etc.)\nBS/MS in Data Science/Machine Learning, Mathematics, Statistics, Information Systems, or related field\nPreferred Qualifications\nSolid understanding of the theory behind statistical analysis and machine learning\nExperience in applying data science / machine learning techniques especially times series forecasting to provide solutions to real business problems\nKnowledge of machine learning techniques especially for time series forecasting\nExperience in developing and maintaining data pipelines\nExperience with cloud data science platforms: Dataiku (preferred), DataRobot, Databricks, AWS SageMaker, Google Cloud AI Platform, etc.\nExperience in full data science project delivery lifecycle - from identifying the underlying business needs to delivering projects in manner that meets those needs\nCuriosity to understand new data science tools and how they can be leveraged to meet business needs\nAbility to translate technical content for non-technical audiences and vice-versa\nStrong verbal / written communication skills\nCreativity to go beyond current tools to deliver the best solution to the problem\nDetail oriented and self-motivated individual able to function effectively when working independently or in a team.\nFamiliarity with MLOps practices is a plus\nExperience with Git is a plus\nExperience using Tableau is a plus\nExperience using Essbase is a plus\nExperience using BusinessObjects is a plus"
}
