{
  "job_id": "nike_senior_product_manager_karnataka",
  "company": "Nike",
  "role": "Senior Product Manager",
  "location": "Karnataka, India",
  "seniority": "Senior",
  "responsibilities": [
    "Enhance the OPS and Partner Hub experiences.",
    "Integrate technology solutions.",
    "Implement feedback mechanisms to continuously improve customer satisfaction.",
    "Define and drive the roadmap and strategies to ensure it aligns with Nike’s CSR and FY AOP.",
    "Advocate solving the right problems for Nike Customers and Domain teams within Nike.",
    "Execute the business product roadmap, prioritizing and planning the features based on the needs of the business.",
    "Translate product roadmap features into well-defined product requirements including features, user stories and acceptance criteria and be the owner of the backlog.",
    "Partner with engineering on design solutions and architectural decisions and advocate the technical directions, and evaluate decisions and their impact on the business functionalities.",
    "Work efficiently in Agile environment, regularly validate the completed stories and check with the business to ensure it meets business product expectation.",
    "Track product features, performance metrics to ensure that the product is meeting or exceeding the targets, pivot the product roadmap direction as needed.",
    "Track value drops delivered, product adoption, and execution against the end-to-end roadmap."
  ],
  "must_have_requirements": [
    "6+ years of experience in Product Management",
    "Bachelor of Engineering in computer science or combination of relevant education, experience",
    "Experience working in Customer Order Management",
    "Experience working on Web UI/UX",
    "Experience working on Cloud platform with API knowledge",
    "Strong Analytical and Data Visualization Skills",
    "Great business acumen and communication skills",
    "Excellent analysis and problem-solving skills",
    "Validated ability to adapt to changing needs, processes, and ambiguity",
    "Strong meeting and work session facilitation skills",
    "Solid grasp on Design Thinking Concepts and Design Leadership"
  ],
  "nice_to_have_requirements": [
    "Understanding of Data integration"
  ],
  "skills": [
    {
      "name": "Product Management",
      "importance": 10,
      "years_of_experience": 6
    },
    {
      "name": "Customer Order Management",
      "importance": 10,
      "years_of_experience": 3
    },
    {
      "name": "Web UI/UX",
      "importance": 10,
      "years_of_experience": 3
    },
    {
      "name": "Cloud Platforms",
      "importance": 10,
      "years_of_experience": 3
    },
    {
      "name": "API",
      "importance": 7,
      "years_of_experience": 1
    },
    {
      "name": "Data Visualization",
      "importance": 7,
      "years_of_experience": 0
    },
    {
      "name": "Analytical Skills",
      "importance": 9,
      "years_of_experience": 0
    },
    {
      "name": "Communication Skills",
      "importance": 9,
      "years_of_experience": 0
    },
    {
      "name": "Problem-solving",
      "importance": 9,
      "years_of_experience": 0
    },
    {
      "name": "AWS Cloud",
      "importance": 4,
      "years_of_experience": 0
    },
    {
      "name": "Microservices",
      "importance": 4,
      "years_of_experience": 0
    },
    {
      "name": "Agile",
      "importance": 4,
      "years_of_experience": 0
    },
    {
      "name": "Confluence",
      "importance": 4,
      "years_of_experience": 0
    },
    {
      "name": "Splunk",
      "importance": 4,
      "years_of_experience": 0
    },
    {
      "name": "Figma",
      "importance": 4,
      "years_of_experience": 0
    },
    {
      "name": "Adobe Analytics",
      "importance": 4,
      "years_of_experience": 0
    },
    {
      "name": "Design Thinking",
      "importance": 4,
      "years_of_experience": 0
    }
  ],
  "tech_stack": [
    "AWS",
    "API",
    "Figma",
    "Splunk",
    "Adobe Analytics"
  ],
  "summary_years_of_experience_min": 6,
  "summary_years_of_experience_max": 10,
  "raw_text": "Senior Product Manager\n4/F, WeWork, Embassy GolfLinks, Karnataka, Karnataka 560093, India\n\nFrom our flagship website and five-star mobile apps to developing products, managing big data and providing leading edge engineering and systems support, our teams at NIKE Global Technology exist to revolutionize the future at the confluence of tech and sport. We invest and develop advances in technology and employ the most creative people in the world, and then give them the support to constantly innovate, iterate and serve consumers more directly and personally.  Our teams are innovative, diverse, multidisciplinary and collaborative, taking technology into the future and bringing the world with it.\n\nWHO YOU’LL WORK WITH\n\nHe/She will be working as part of Geographies and Marketplace experiences(GAME) Global Technology organisation. Within this organisation he/she will be part of Partner Buy and Post Purchase Team.\n\nWithin Partner Buy and PP team, ITC teams are focused on Nike Teams Order Processing System (OPS) and Partner Engineering. Nike Teams is Nike’s B2B e-commerce platform designed for the North American market, primarily serving sports teams, corporate groups, and wholesale partners. OPS (Order Processing System) is Nike Teams’ dedicated order management platform, supporting end-to-end processing of custom apparel orders placed via NikeTeam. In addition, The Partner Engineering team focuses on the domains across Nike to ensure all incoming and outgoing data will be routed through the Partner Hub. Part of this effort is to consolidate Nike’s API portfolio into a secure, consistent, well-documented, and reliable suite of API for Nike’s partners.\n\nSenior Product Manager plays an integral part of the Global Technology team as Nike is focused on the Win Now Strategy. This position sits within India Technology Centre (ITC) reporting to Sr Manager, Product Management GAME ITC.\n\nHe/She will be working closely with Ops team, Geo leads, Global Product Managers and business stakeholders located in WHQ, cross-functional partnering teams within and outside of ITC as well as with engineering teams on a daily basis.\n\nWHO WE ARE LOOKING FOR\n\nWe seek a visionary Senior Product Manager with a passion for serving the consumers. The ideal candidate will have a proven track record in product management, exceptional analytical skills, and the ability to collaborate across cross functional teams. He/she should be driven by data and insights, with a focus on delivering an ultimate consumer experience. Strong leadership, communication, are essential, with experience forming alliances and bringing together multiple partners to execute on a common mission.\n\nWe're looking for someone with 6+ years of experience in Product Management and clearly demonstrated these skills:\n\nBachelor of Engineering in computer science or combination of relevant education, experience\n\nExperience working in Customer Order Management is a must.\n\nExperience working on Web UI/UX is a must.\n\nExperience working on Cloud platform with API knowledge is a must.\n\nUnderstanding of Data integration is a plus.\n\nStrong Analytical and Data Visualization Skills\n\nGreat business acumen and communication skills\n\nExcellent analysis and problem-solving skills\n\nPrior experience owning experiences and platforms implemented on AWS Cloud, micros services architecture, domain event architecture\n\nExperience with Agile tools, confluence, splunk, Figma, Adobe analytics.\n\nValidated ability to adapt to changing needs, processes, and ambiguity\n\nStrong meeting and work session facilitation skills\n\nSolid grasp on Design Thinking Concepts and Design Leadership\n\nWHAT YOU’LL WORK ON\n\nAs a Senior Product Manager for Partner Buy and Post Purchase team, He/She will\n\nHe/She will focus on enhancing the OPS and Partner Hub experiences, integrating technology solutions, and implementing feedback mechanisms to continuously improve customer satisfaction. Ultimately, you’ll play a key role in shaping the future of Nike. Define and drive the roadmap and strategies to ensure it aligns with Nike’s CSR and FY AOP in partnership with functional leadership as well as business/ops teams. Be an advocate of solving the right problems for our Nike Customers and Domain teams within Nike. Execute the business product roadmap, prioritizing and planning the features based on the needs of the business. Translate product roadmap features into well-defined product requirements including features, user stories and acceptance criteria and be the owner of the backlog. Partner with engineering on design solutions and architectural decisions and advocate the technical directions, and evaluate decisions and their impact on the business functionalities. Work efficiently in Agile environment, regularly validate the completed stories and check with the business to ensure it meets business product expectation. Track product features, performance metrics to ensure that the product is meeting or exceeding the targets, pivot the product roadmap direction as needed. Track value drops delivered, product adoption, and execution against the end-to-end roadmap. Great product sense and communicate effectively both verbally and written in a variety of settings and tailor communications to the target audience. Influence others through optimism, self-assurance, and fact-based recommendations.\n\nNIKE, Inc. is a growth company that looks for team members to grow with it. Nike offers a generous total rewards package, casual work environment, a diverse and inclusive culture, and an electric atmosphere for professional development. No matter the location, or the role, every Nike employee shares one galvanizing mission: To bring inspiration and innovation to every athlete* in the world.\n"
}
