{
  "job_id": "spotify_associate_manager_new_york",
  "company": "Spotify",
  "role": "Associate Manager",
  "location": "New York",
  "seniority": "Mid-level",
  "responsibilities": [
    "Lead Spotify for Publishers (S4P) Operations.",
    "Manage day-to-day operations of the S4P platform, including onboarding, data management, and publisher support.",
    "Recommend and implement product and process improvements to enhance user experience and data accuracy.",
    "Drive Data and Rights Management Initiatives.",
    "Oversee publishing data integrations and transitions with key partners.",
    "Partner with data, licensing, and product teams to ensure compliance and maintain publishing data integrity.",
    "Collaborate Across Teams and the Industry.",
    "Work cross-functionally with Licensing, Legal, Accounting, and Product to deliver cohesive operational solutions.",
    "Represent Spotify in industry working groups focused on metadata, rights management, and digital licensing standards.",
    "Act as an operational point of contact for U.S. publishing partners and licensors.",
    "Support Licensing and Metadata Strategy.",
    "Lead transitions of licensors to the Common Data Model (CDM) to modernise global publishing data structures.",
    "Help shape Spotify’s publishing products through research, testing, and partner engagement.",
    "Provide analytical and data support for U.S. licensing and compliance efforts."
  ],
  "must_have_requirements": [
    "5+ years of experience in music publishing operations, rights management, or related fields.",
    "Deep understanding of U.S. mechanical licensing and publishing data workflows.",
    "Familiar with industry standards and organisations (CWR, ISWC, CISAC, MLC, etc.).",
    "Strong communicator and collaborator across internal teams and external stakeholders.",
    "Skilled at managing complex data projects and driving cross-functional initiatives to completion.",
    "Passionate about improving transparency, accuracy, and efficiency in the music publishing ecosystem."
  ],
  "nice_to_have_requirements": [],
  "skills": [
    {
      "skill": "Music Publishing Operations",
      "importance": 9
    },
    {
      "skill": "Rights Management",
      "importance": 9
    },
    {
      "skill": "Data Management",
      "importance": 7
    },
    {
      "skill": "Data Integrations",
      "importance": 7
    },
    {
      "skill": "Cross-functional Collaboration",
      "importance": 8
    },
    {
      "skill": "Communication",
      "importance": 8
    },
    {
      "skill": "Project Management",
      "importance": 7
    },
    {
      "skill": "Analytical Skills",
      "importance": 6
    },
    {
      "skill": "Metadata",
      "importance": 7
    },
    {
      "skill": "Licensing",
      "importance": 8
    },
    {
      "skill": "CWR",
      "importance": 5
    },
    {
      "skill": "ISWC",
      "importance": 5
    },
    {
      "skill": "CISAC",
      "importance": 5
    },
    {
      "skill": "MLC",
      "importance": 5
    }
  ],
  "years_of_experience": 5,
  "tech_stack": [],
  "experience_summary": {
    "years_minimum": 5,
    "years_maximum": 0
  },
  "raw_text": "Associate Manager\nMusic Publishing Operations US\n\nNew York\nSpotify’s Publishing Operations team powers the systems and partnerships that ensure songwriters and publishers are paid accurately and transparently. As we continue to enhance data interoperability, and modernize rights management, we’re looking for a Publishing Operations Associate Manager to help drive the next phase of growth.\nIn this role, you’ll help shape how Spotify manages publishing data globally leading initiatives across systems, metadata, licensing operations, and industry partnerships. You’ll collaborate closely with internal teams and external stakeholders to make publishing more efficient, scalable, and future-ready.\n\nWhat You'll Do\n\nLead Spotify for Publishers (S4P) Operations\nManage the day-to-day operations of our S4P platform, including onboarding, data management, and publisher support.\nRecommend and implement product and process improvements to enhance user experience and data accuracy.\nDrive Data and Rights Management Initiatives\nOversee publishing data integrations and transitions with key partners.\nPartner with data, licensing, and product teams to ensure compliance and maintain publishing data integrity.\nCollaborate Across Teams and the Industry\nWork cross-functionally with Licensing, Legal, Accounting, and Product to deliver cohesive operational solutions.\nRepresent Spotify in industry working groups focused on metadata, rights management, and digital licensing standards.\nAct as an operational point of contact for our U.S. publishing partners and licensors.\nSupport Licensing and Metadata Strategy\nLead transitions of licensors to the Common Data Model (CDM) to modernize global publishing data structures.\nHelp shape Spotify’s publishing products through research, testing, and partner engagement.\nProvide analytical and data support for U.S. licensing and compliance efforts.\n\nWho You Are\n\n5+ years of experience in music publishing operations, rights management, or related fields.\nDeep understanding of U.S. mechanical licensing and publishing data workflows.\nFamiliar with industry standards and organizations (CWR, ISWC, CISAC, MLC, etc.).\nStrong communicator and collaborator across internal teams and external stakeholders.\nSkilled at managing complex data projects and driving cross-functional initiatives to completion.\nPassionate about improving transparency, accuracy, and efficiency in the music publishing ecosystem.\n\nWhere You'll Be\n\nThis role will be based in New York City\nWe offer you the flexibility to work where you work best! There will be some in person meetings, but still allows for flexibility to work from home.\n\nThe United States base range for this position is $86,860 - $124,085, plus equity. The benefits available for this position include health insurance, six month paid parental leave, 401(k) retirement plan, monthly meal allowance, 23 paid days off, 13 paid flexible holidays. This range encompasses multiple levels. Leveling is determined during the interview process. Placement in a level depends on relevant work history and interview performance. These ranges may be modified in the future."
}
