{
  "job_id": "apple_partnerships_specialist_emea_london",
  "company": "Apple",
  "location": "London, England, United Kingdom",
  "title": "Partnerships Specialist EMEA (Apple Ads)",
  "department": "Marketing",
  "seniority": "Mid-level",
  "salary": null,
  "currency": null,
  "responsibilities": [
    "Manage and grow existing partnerships, identifying new ways to scale and create value.",
    "Guide partners to evolve and innovate in line with business goals.",
    "Collaborate across teams to showcase partner capabilities and integrate them effectively into business strategies.",
    "Track and report on partnership performance, driving accountability and measurable results",
    "Manage the day-to-day interactions with the partner, specifically in the EMEA region",
    "Help the business development teams with onboarding of new partners into the Apple Partner Program",
    "Understand the technical and operational requirements of our partners and work closely with the internal teams to support execution and troubleshooting",
    "Collect partner and overall market feedback to guide Apple Ads strategy across domains",
    "Prepare and give business reviews to the senior management team regarding progress, successful initiatives and roadblocks",
    "Initiate and lead exploratory communications to drive new business opportunities and product growth initiatives with these partners, working with product, partner management, legal, integrations, and other cross-functional stakeholders as required",
    "Develop an understanding of products to inform and influence partner roadmaps in collaborations of our technical teams and help with identifying mutually beneficial opportunities that can help with product development",
    "Analyze data and provide data-driven insights to improve our partnership opportunity",
    "Manage partnerships to deliver results, and build long-term partner relationships",
    "Work with finance and analytics team to reconcile incentives",
    "Represent the Channel Partnerships team in external and internal meetings, some travel in the region maybe required"
  ],
  "must_have_requirements": [
    "Advertising partner manager/ account management experience",
    "Strong relationship building and diplomatic communication skills",
    "Excellent written and verbal communication skills",
    "Detail oriented and have exceptional organisational skills",
    "Proactive self-starter with a professional, positive demeanour",
    "Strong analytical and problem solving skills, and a solutions-oriented focus",
    "Ability to work independently and with a team in a fast paced, rapidly-changing environment",
    "High level of technology experience, with an understanding of the latest advertising technology"
  ],
  "nice_to_have_requirements": [
    "Prior experience in partnerships orgs",
    "Key industry experience across any or all of the following; advertising sales, digital media planning, account management, business development, publisher services and/or ad network services"
  ],
  "skills": [
    {
      "skill": "Account Management",
      "importance": 8,
      "years_of_experience": 3
    },
    {
      "skill": "Advertising Sales",
      "importance": 6,
      "years_of_experience": 0
    },
    {
      "skill": "Digital Media Planning",
      "importance": 6,
      "years_of_experience": 0
    },
    {
      "skill": "Business Development",
      "importance": 6,
      "years_of_experience": 0
    },
    {
      "skill": "Analytical Skills",
      "importance": 8,
      "years_of_experience": 3
    },
    {
      "skill": "Problem Solving",
      "importance": 8,
      "years_of_experience": 3
    },
    {
      "skill": "Communication Skills",
      "importance": 9,
      "years_of_experience": 0
    },
    {
      "skill": "Relationship Building",
      "importance": 9,
      "years_of_experience": 3
    },
    {
      "skill": "Advertising Technology",
      "importance": 7,
      "years_of_experience": 0
    }
  ],
  "tech_stack": [
    "Advertising"
  ],
  "min_years_experience": 3,
  "max_years_experience": 0,
  "raw_text": "Partnerships Specialist EMEA (Apple Ads)\nLondon, England, United Kingdom\nMarketing\nSummary\nPosted:\n19 Nov 2025\nWeekly Hours:\n35\nRole Number:\n200632279-2114\nAt Apple, we believe in the power of technology to enrich people's lives. Everything we build is designed to empower people, including our advertising platform. We deliver ads in a way that benefits both customers and advertisers — helping people discover content, supporting creators, and protecting and respecting everyone’s privacy. Our technology makes advertising possible on the App Store, Apple News, Stocks, and Apple TV. We help developers and marketers of all sizes drive app discovery across the App Store. Our display ads on Apple News and Stocks let advertisers promote their products alongside trusted content in a brand-safe environment, while supporting publishers and journalists. Sponsorship integrations and experiences in live sports on Apple TV help advertisers connect with captivated audiences. Everything we do is with the unwavering dedication to privacy you expect from Apple. Because when advertising is done right, it benefits everyone!\nDescription\nWe’re looking for a Partnerships Specialist to take ownership of our existing strategic partnerships and drive their ongoing growth and success. As an individual contributor, you’ll focus on developing, scaling, and optimizing partnerships to deliver the best possible value for both our business and our partners across the EMEA market.\nYou’ll work closely with cross-functional teams to identify opportunities for innovation, improve performance, and ensure our partnerships are fully aligned with business priorities. This role is highly collaborative and requires strong relationship management, strategic thinking, and the ability to translate partnership potential into measurable impact.\n\nResponsibilities\nManage and grow existing partnerships, identifying new ways to scale and create value.\nGuide partners to evolve and innovate in line with business goals.\nCollaborate across teams to showcase partner capabilities and integrate them effectively into business strategies.\nTrack and report on partnership performance, driving accountability and measurable results\nManage the day-to-day interactions with the partner, specifically in the EMEA region\nHelp the business development teams with onboarding of new partners into the Apple Partner Program\nUnderstand the technical and operational requirements of our partners and work closely with the internal teams to support execution and troubleshooting\nCollect partner and overall market feedback to guide Apple Ads strategy across domains\nPrepare and give business reviews to the senior management team regarding progress, successful initiatives and roadblocks\nInitiate and lead exploratory communications to drive new business opportunities and product growth initiatives with these partners, working with product, partner management, legal, integrations, and other cross-functional stakeholders as required\nDevelop an understanding of products to inform and influence partner roadmaps in collaborations of our technical teams and help with identifying mutually beneficial opportunities that can help with product development\nAnalyze data and provide data-driven insights to improve our partnership opportunity\nManage partnerships to deliver results, and build long-term partner relationships\nWork with finance and analytics team to reconcile incentives\nRepresent the Channel Partnerships team in external and internal meetings , some travel in the region maybe required\nMinimum Qualifications\nMust have Advertising partner manager/ account management experience\nPrior experience in partnerships orgs will be a plus\nStrong relationship building and diplomatic communication skills\nExcellent written and verbal communication skills\nMust be detail oriented and have exceptional organisational skills\nProactive self-starter with a professional, positive demeanour\nMust have strong analytical and problem solving skills, and a solutions-oriented focus\nAbility to work independently and with a team in a fast paced, rapidly-changing environment\nHigh level of technology experience, with an understanding of the latest advertising technology\nPreferred Qualifications\nIdeally, the preferred candidate will have key industry experience across any or all of the following; advertising sales, digital media planning, account management, business development, publisher services and/or ad network services\n\nAt Apple, we’re not all the same. And that’s our greatest strength. We draw on the differences in who we are, what we’ve experienced and how we think. Because to create products that serve everyone, we believe in including everyone. Therefore, we are committed to treating all applicants fairly and equally. As a registered Disability Confident employer, we will work with applicants to make any reasonable accommodations. Apple will consider for employment all qualified applicants with criminal backgrounds in a manner consistent with applicable law. Learn more\n\nSubmit CV"
}
