{
  "job_id": "apple_emeia_sales_bpr_data_enabling_platforms_manager_london",
  "company": "Apple",
  "role": "EMEIA Sales BPR, Data & Enabling Platforms Manager",
  "location": "London, England, United Kingdom",
  "seniority": "Senior",
  "responsibilities": [
    "Lead and develop a team of project managers and business/data architects.",
    "Lead foundational data initiatives to unlock regional insights and power future AI/ML capabilities.",
    "Coach, mentor, and develop team members.",
    "Drive innovation by introducing new technologies and process improvements.",
    "Partner with global and regional stakeholders across Sales, Finance, IS&T, Operations, master Data, and external vendors.",
    "Lead the regional deployment of global capital projects and implement global standards.",
    "Oversee the planning, execution, and delivery of complex projects.",
    "Foster collaboration and cross functional relationships."
  ],
  "must_have_requirements": [
    "Extensive experience in the technology industry with a strong record of project execution.",
    "Proven experience in project leadership across complex, matrixed, and international environments",
    "Demonstrated track record of leading multi-disciplinary teams to deliver large-scale and concurrent projects",
    "Strong leadership, organisation, and resource management skills",
    "Strategic thinker capable of balancing big-picture focus with detailed execution",
    "Excellent influencing, negotiation, and stakeholder management skills",
    "Able to create a bridge between data teams and business functions",
    "Recognised change agent with success in implementing organisational transformation",
    "Exceptional communication, presentation, and collaboration capabilities"
  ],
  "nice_to_have_requirements": [
    "Experience managing geographically dispersed teams",
    "Bachelor’s or Master’s degree in Business, Technology, or related field, or equivalent experience"
  ],
  "skills": [
    {
      "skill": "Project Management",
      "importance": 9,
      "years_of_experience": 3
    },
    {
      "skill": "Data Architecture",
      "importance": 8,
      "years_of_experience": 3
    },
    {
      "skill": "Leadership",
      "importance": 10,
      "years_of_experience": 3
    },
    {
      "skill": "Stakeholder Management",
      "importance": 9,
      "years_of_experience": 3
    },
    {
      "skill": "Communication",
      "importance": 9,
      "years_of_experience": 0
    },
    {
      "skill": "AI/ML",
      "importance": 7,
      "years_of_experience": 0
    },
    {
      "skill": "Negotiation",
      "importance": 7,
      "years_of_experience": 0
    },
    {
      "skill": "Change Management",
      "importance": 7,
      "years_of_experience": 0
    }
  ],
  "tech_stack": [],
  "years_of_experience_min": 3,
  "years_of_experience_max": 0,
  "education_requirements": [],
  "salary_min": null,
  "salary_max": null,
  "raw_text": "EMEIA Sales BPR, Data & Enabling Platforms Manager\nLondon, England, United Kingdom\nSales and Business Development\nSummary\nPosted:\n20 Nov 2025\nWeekly Hours:\n35\nRole Number:\n200631483-2114\nImagine what you could do here. The people here at Apple don’t just create products —they create the kind of wonder that’s revolutionised entire industries. It’s the diversity of those people and their ideas that inspires the innovation that runs through everything we do, from amazing technology to industry-leading environmental efforts. Join Apple, and help us leave the world better than we found it.  \n\nApple’s Sales organisation generates the revenue needed to fuel our ongoing development of products and services. This in turn, enriches the lives of hundreds of millions of people around the world. Our sales team, is in many ways, the face of Apple to our largest customers.\nDescription\nThe EMEIA Sales BPR Manager is a pivotal role within Apple’s Sales Planning & Operations (SP&O) organisation in Europe, Middle East, and India. As the manager, you will oversee a team of project managers and business/data architects, designing, implementing, and sustaining high-impact projects across the region. You will be responsible for driving innovation and continuously improving business performance within the sales reporting, data governance, systems, and tools domains.\nResponsibilities\nLead and develop a  team of project managers and business/data architects to deliver world-class solutions and capabilities.\nLead foundational data initiatives that will help unlock regional insights and power future AI/ML capabilities\nCoach, mentor, and develop team members to foster professional growth and excellence.\nDrive innovation by introducing new technologies and process improvements\nPartner closely with global and regional stakeholders across Sales, Finance, IS&T, Operations, master Data, and external vendors.\nLead the regional deployment of global capital projects and implement global standards.\nOversee the planning, execution, and delivery of complex projects within scope, schedule, and quality standards.\nFoster collaboration and cross functional relationships\nMinimum Qualifications\nExtensive experience in the technology industry with a strong record of project execution.\nProven experience in project leadership across complex, matrixed, and international environments\nDemonstrated track record of leading multi-disciplinary teams to deliver large-scale and concurrent projects\nStrong leadership, organisation, and resource management skills\nStrategic thinker capable of balancing big-picture focus with detailed execution\nExcellent influencing, negotiation, and stakeholder management skills\nAble to create a bridge between data teams and business functions, ensuring stakeholder needs are met and translated into impactful data initiatives\nRecognised change agent with success in implementing organisational transformation\nExceptional communication, presentation, and collaboration capabilities\nPreferred Qualifications\nExperience managing geographically dispersed teams\nBachelor’s or Master’s degree in Business, Technology, or related field, or equivalent experience"
}
