{
  "job_id": "apple_specialist_unitedkingdom",
  "company": "Apple",
  "role": "Specialist",
  "location": "United Kingdom",
  "seniority": "Mid-level",
  "responsibilities": [
    "Deliver excellent service to Apple customers by understanding their needs.",
    "Identify ownership opportunities and present products and services.",
    "Educate customers on relevant ways to buy products.",
    "Stay up to date on Apple’s products, services, purchase options and Product Zone sales processes.",
    "Support peers by sharing knowledge about Apple’s products, services and purchase options.",
    "Assist in offering ownership opportunities.",
    "Maintain accuracy and follow guidance.",
    "Perform other tasks as needed, including providing customer service and support in other areas of the store.",
    "Contribute to an inclusive environment by respecting each other’s differences.",
    "Demonstrate Apple’s values of inclusion and diversity in daily activities."
  ],
  "must_have_requirements": [
    "Availability to work a schedule based on business needs that may include nights, weekends and public holidays.",
    "Reliably attend work as scheduled, in line with local laws and subject to any approved accommodations.",
    "Proficient in the local language, both written and spoken (sign language supported)."
  ],
  "nice_to_have_requirements": [
    "Demonstrate knowledge of Apple products and services.",
    "Personalise solutions based on customer needs, and effectively communicate them.",
    "Work in a fast-paced environment, often supporting multiple customers at the same time.",
    "Work in a team environment, demonstrating shared responsibility and accountability with other team members.",
    "Be curious and open to learning from others and helping each other grow.",
    "Learn about and deepen your understanding of Apple products and services, and third-party products, to enhance the customer experience.",
    "Be trusted with sensitive or confidential information, keeping with Apple’s core values."
  ],
  "skills": [
    {
      "name": "Customer Service",
      "importance": 9,
      "years_of_experience": 0
    },
    {
      "name": "Communication",
      "importance": 7,
      "years_of_experience": 0
    },
    {
      "name": "Teamwork",
      "importance": 7,
      "years_of_experience": 0
    },
    {
      "name": "Apple Products",
      "importance": 6,
      "years_of_experience": 0
    }
  ],
  "tech_stack": [],
  "min_years_experience": 0,
  "max_years_experience": 0,
  "raw_text": "UK - Specialist: Full-Time, Part-Time, and Part-Time Temporary\nUnited Kingdom\nApple Retail\n\nSummary\nPosted:\n24 Nov 2025\nRole Number:\n114438145\nApple Retail is where the best of Apple comes together. We bring our expertise to help people do what they love, delivering an only-at-Apple experience. We believe inclusion is a shared responsibility and we work together to foster a culture where everyone belongs and is inspired to do their best work.\n\nAs a Specialist, you build brand loyalty and create owners of Apple products and services. You’re dedicated to selling and delivering a customer service experience that is unlike any other. A Specialist is curious — you ask questions to learn about our customers’ needs, customising recommendations to enrich their lives.\n\nIn this role, you could work full-time, part-time or part-time temporary.\nDescription\nDeliver excellent service to Apple customers by seeking to understand their needs, identifying ownership opportunities, presenting products and services, and educating customers on relevant ways to buy products.\n\nUnderstand and proactively stay up to date on Apple’s products, services, purchase options and Product Zone sales processes.\n\nSupport your peers throughout the store as needed by sharing knowledge about Apple’s products, services and purchase options, and assist in offering ownership opportunities.\n\nMaintain accuracy and follow guidance.\n\nPerform other tasks as needed, including but not limited to providing customer service and support in other areas of the store.\n\nContribute to an inclusive environment by respecting each other’s differences and having the curiosity to learn.\n\nDemonstrate Apple’s values of inclusion and diversity in daily activities.\nMinimum Qualifications\nYou should have availability to work a schedule based on business needs that may include nights, weekends and public holidays in the retail store, and reliably attend work as scheduled, in line with local laws and subject to any approved accommodations.\nYou should also be proficient in the local language, both written and spoken (sign language supported).\nPreferred Qualifications\nYou can:\nDemonstrate knowledge of Apple products and services.\nPersonalise solutions based on customer needs, and effectively communicate them.\nWork in a fast-paced environment, often supporting multiple customers at the same time.\nWork in a team environment, demonstrating shared responsibility and accountability with other team members.\nBe curious and open to learning from others and helping each other grow.\nLearn about and deepen your understanding of Apple products and services, and third-party products, to enhance the customer experience.\nBe trusted with sensitive or confidential information, keeping with Apple’s core values."
}
