{
  "jobId": "backstage_business_development_representative_new_york",
  "title": "Business Development Representative",
  "company": "Backstage",
  "location": "New York",
  "seniority": "Mid-level",
  "responsibilities": [
    "Identifying and researching potential clients or markets to pursue new business opportunities.",
    "Reaching out to prospects through various channels such as cold calling, emailing, social media, or networking events to introduce the company's products or services.",
    "Assessing the suitability of leads by understanding their needs, budget, timeline, and decision-making process.",
    "Building relationships with prospects by providing relevant information, answering questions, and addressing concerns to move them through the sales funnel.",
    "Scheduling appointments, demos, or meetings for the sales team with qualified prospects.",
    "Recording and tracking interactions with prospects in a Customer Relationship Management (CRM) system to maintain accurate records and facilitate follow-up activities.",
    "Working closely with the sales and marketing teams to align strategies, share insights, and optimise lead generation efforts.",
    "Monitoring key performance indicators (KPIs) such as conversion rates, response rates, and pipeline velocity, and providing regular reports to management on progress and challenges."
  ],
  "mustHaveRequirements": [
    "1-2 years of B2B sales, marketing or customer facing experience, ideally in SaaS or technology, selling to mid-market or enterprise accounts, including previous outbound prospecting experience",
    "Self-starter with the ability to work in a fast-paced, dynamic environment",
    "A proven record of consistently exceeding quotas",
    "A good understanding of forecasting & pipeline management",
    "Excellent written and verbal communication skills with ability to sell at all levels from individual contributors to C-Suite",
    "Strong customer orientation and a passion for delivering a world-class customer experience"
  ],
  "niceToHaveRequirements": [
    "Experience with CRMs (experience with Hubspot highly preferred)"
  ],
  "skills": [
    {
      "name": "B2B Sales",
      "importance": 8,
      "yearsOfExperience": 1
    },
    {
      "name": "Marketing",
      "importance": 6,
      "yearsOfExperience": 1
    },
    {
      "name": "SaaS",
      "importance": 7,
      "yearsOfExperience": 1
    },
    {
      "name": "CRM",
      "importance": 7,
      "yearsOfExperience": 0
    },
    {
      "name": "Hubspot",
      "importance": 5,
      "yearsOfExperience": 0
    },
    {
      "name": "Communication Skills",
      "importance": 9,
      "yearsOfExperience": 0
    },
    {
      "name": "Pipeline Management",
      "importance": 7,
      "yearsOfExperience": 0
    }
  ],
  "techStack": [
    "SaaS",
    "CRM",
    "Hubspot"
  ],
  "minYearsOfExperience": 1,
  "maxYearsOfExperience": 2,
  "rawText": "Business Development Representative\nBackstage\n\nNew York\nOriginated from Spotify, Backstage is a leading open source platform for building developer portals. Adopted by hundreds of companies, Backstage helps customers to restore order to their microservices and infrastructure and enables product teams to ship high-quality code quickly — without compromising autonomy.\nInterested in helping us drive Spotify’s developer portal philosophy among the most advanced tech companies? We in Spotify’s Backstage team are looking for our first Business Development Representative to help get our product into the hands of our very first customers.\nJoin a nimble, startup-like team of engineers, marketers, business developers, and product managers to drive an entirely new technology-focused business line and distribution channel.\nA Business Development Representative (BDR) is a key member of a company's sales team responsible for generating leads and qualifying prospects. Their primary role is to research potential clients, initiate contact, and schedule meetings or demonstrations for the sales team. You will generate meetings for Account Executives and educating customers that are interested in purchasing Spotify Plugins for Backstage. \n\nWhat You'll Do\n\nProspecting: Identifying and researching potential clients or markets to pursue new business opportunities.\nOutreach: Reaching out to prospects through various channels such as cold calling, emailing, social media, or networking events to introduce the company's products or services.\nQualifying Leads: Assessing the suitability of leads by understanding their needs, budget, timeline, and decision-making process.\nLead Nurturing: Building relationships with prospects by providing relevant information, answering questions, and addressing concerns to move them through the sales funnel.\nAppointment Setting: Scheduling appointments, demos, or meetings for the sales team with qualified prospects.\nCRM Management: Recording and tracking interactions with prospects in a Customer Relationship Management (CRM) system to maintain accurate records and facilitate follow-up activities.\nCollaboration: Working closely with the sales and marketing teams to align strategies, share insights, and optimize lead generation efforts.\nMetrics and Reporting: Monitoring key performance indicators (KPIs) such as conversion rates, response rates, and pipeline velocity, and providing regular reports to management on progress and challenges.\nOverall, a Business Development Representative plays a vital role in driving revenue growth by expanding the company's customer base and establishing valuable connections within the target market.\n\nWho You Are\n\nHave 1-2 years of B2B sales, marketing or customer facing experience, ideally in SaaS or technology, selling to mid-market or enterprise accounts, including previous outbound prospecting experience\nSelf-starter with the ability to work in a fast-paced, dynamic environment\nA proven record of consistently exceeding quotas\nA good understanding of forecasting & pipeline management\nExcellent written and verbal communication skills with ability to sell at all levels from individual contributors to C-Suite\nExperience with CRMs (experience with Hubspot highly preferred)\nStrong customer orientation and a passion for delivering a world-class customer experience\n\nThe United States base range for this position is $87,070- $124,385 plus equity. The benefits available for this position include health insurance, six month paid parental leave, 401(k) retirement plan, monthly meal allowance, 23 paid days off, 13 paid flexible holidays, paid sick leave. These ranges may be modified in the future."
}
