{
  "job_id": "apple_software_development_engineer_cambridge",
  "company": "Apple",
  "location": "Cambridge, England, United Kingdom",
  "title": "Software Development Engineer, Photos UI",
  "seniority": "Mid-level",
  "responsibilities": [
    "Develop and implement software for new AI-powered features, working with technologies like Large Language Models (LLMs) and on-device machine learning.",
    "Collaborate closely with AI/ML researchers and senior engineers to transform research concepts into robust, user-facing products.",
    "Write clean, efficient, and well-tested code in languages like Swift, Python, and C++.",
    "Contribute to the entire development lifecycle, from prototyping new ideas to debugging, optimising, and shipping features to millions of users.",
    "Learn and grow in a fast-paced, supportive environment, gaining hands-on experience with cutting-edge AI technologies and Apple's software engineering practices."
  ],
  "must_have_requirements": [
    "BS/MS in Computer Science or a related field, or equivalent practical experience.",
    "Solid understanding of computer science fundamentals, including data structures, algorithms, and software design.",
    "Proficiency in at least one object-oriented or systems programming language (e.g., Python, Swift, C++, Java).",
    "A foundational understanding of machine learning concepts (from coursework, personal projects, or professional experience)."
  ],
  "nice_to_have_requirements": [
    "Exposure with professional software development experience.",
    "Familiarity with iOS, macOS, or other mobile application development. Experience with Swift is a strong plus.",
    "Experience building or integrating machine learning models into applications.",
    "Excellent communication and collaboration skills, with a desire to work in a team environment."
  ],
  "skills": [
    {
      "name": "Python",
      "importance": 8,
      "years_of_experience": 0
    },
    {
      "name": "Swift",
      "importance": 8,
      "years_of_experience": 0
    },
    {
      "name": "C++",
      "importance": 7,
      "years_of_experience": 0
    },
    {
      "name": "Java",
      "importance": 5,
      "years_of_experience": 0
    },
    {
      "name": "Machine Learning",
      "importance": 7,
      "years_of_experience": 0
    },
    {
      "name": "iOS",
      "importance": 5,
      "years_of_experience": 0
    },
    {
      "name": "MacOS",
      "importance": 5,
      "years_of_experience": 0
    },
    {
      "name": "Data Structures",
      "importance": 8,
      "years_of_experience": 0
    },
    {
      "name": "Algorithms",
      "importance": 8,
      "years_of_experience": 0
    },
    {
      "name": "Software Design",
      "importance": 8,
      "years_of_experience": 0
    },
    {
      "name": "Communication Skills",
      "importance": 6,
      "years_of_experience": 0
    },
    {
      "name": "Collaboration",
      "importance": 6,
      "years_of_experience": 0
    }
  ],
  "tech_stack": [
    "Python",
    "Swift",
    "C++",
    "Java",
    "Machine Learning",
    "iOS",
    "MacOS"
  ],
  "years_of_experience_min": 0,
  "years_of_experience_max": 0,
  "experience_summary": {
    "data_science": 0,
    "machine_learning": 0,
    "software_engineering": 0
  },
  "raw_text": "Software Development Engineer, Photos UI\nCambridge, England, United Kingdom\nSoftware and Services\nSummary\nPosted:\n19 Nov 2025\nWeekly Hours:\n35\nRole Number:\n200632512-1251\nAt Apple, we build products that become part of people's lives. The Photos app is where life's most precious moments live, and our team uses Apple Intelligence to make those moments even more meaningful.\n\nThe Photos Intelligence team is at the cutting edge of this mission. We are the engineers and researchers building AI-powered experiences that help millions of users rediscover memories, relive perfect moments, and find new meaning in their visual stories.\n\nAs a Software Engineer on our team, you will play a key role in building these intelligent experiences, turning innovative concepts into features that millions of people will love. This is a unique opportunity to grow your skills at the intersection of machine learning and product development.\nDescription\nIn this role, you will be a key contributor to the team, helping to build the next generation of intelligent features for the Photos app. \nYou will:\n- Develop and implement software for new AI-powered features, working with technologies like Large Language Models (LLMs) and on-device machine learning.\n- Collaborate closely with AI/ML researchers and senior engineers to transform research concepts into robust, user-facing products.\n- Write clean, efficient, and well-tested code in languages like Swift, Python, and C++.\n- Contribute to the entire development lifecycle, from prototyping new ideas to debugging, optimizing, and shipping features to millions of users.\n- Learn and grow in a fast-paced, supportive environment, gaining hands-on experience with cutting-edge AI technologies and Apple's software engineering practices.\nResponsibilities\nWe are looking for someone passionate about building amazing products, with an excellent foundation in computer science and an eagerness to learn. You don't need to be an expert in AI, but you should be excited by its potential.\nMinimum Qualifications\nBS/MS in Computer Science or a related field, or equivalent practical experience.\nSolid understanding of computer science fundamentals, including data structures, algorithms, and software design.\nProficiency in at least one object-oriented or systems programming language (e.g., Python, Swift, C++, Java).\nA foundational understanding of machine learning concepts (from coursework, personal projects, or professional experience).\nPreferred Qualifications\nExposure with professional software development experience.\nFamiliarity with iOS, macOS, or other mobile application development. Experience with Swift is a strong plus.\nExperience building or integrating machine learning models into applications.\nExcellent communication and collaboration skills, with a desire to work in a team environment."
}
