{
  "job_id": "astonmartin_performance_data_analyst_gaydon",
  "company": "Aston Martin",
  "role": "Performance Data Analyst",
  "location": "Gaydon, Warwickshire",
  "seniority": "Senior",
  "responsibilities": [
    "Analyse global and regional dealer performance across sales, aftersales, standards, financial performance, and customer experience.",
    "Build and enhance dashboards, scorecards, and visualisations using Tableau, Salesforce, and Power BI.",
    "Assess market performance, competitor activity, and vehicle parc trends to shape network strategy and decision-making.",
    "Translate data into insights, and measurable plans that drive improvement.",
    "Collaborate with cross-functional teams to strengthen data integrity, reporting accuracy, and insight delivery.",
    "Present analytical findings and performance insights to the senior leadership team.",
    "Champion a culture of data-led thinking."
  ],
  "must_have_requirements": [
    "Proven experience in commercial, performance, or data analytics.",
    "Strong knowledge of Salesforce, Tableau, and Power BI for analysis and visualisation.",
    "Advanced Excel skills (including macros).",
    "A degree in Data Analytics, Economics, Business, or a related discipline — or equivalent experience.",
    "A track record of improving data quality, governance, and insight delivery.",
    "Excellent communication skills.",
    "Collaborative, resilient."
  ],
  "nice_to_have_requirements": [],
  "skills": [
    {
      "name": "Data Analytics",
      "importance": 9,
      "years_of_experience": 3
    },
    {
      "name": "Tableau",
      "importance": 8,
      "years_of_experience": 3
    },
    {
      "name": "Salesforce",
      "importance": 8,
      "years_of_experience": 3
    },
    {
      "name": "Power BI",
      "importance": 8,
      "years_of_experience": 3
    },
    {
      "name": "Excel",
      "importance": 7,
      "years_of_experience": 3
    },
    {
      "name": "Communication Skills",
      "importance": 7,
      "years_of_experience": 0
    },
    {
      "name": "Commercial Awareness",
      "importance": 7,
      "years_of_experience": 3
    }
  ],
  "tech_stack": [
    "Tableau",
    "Salesforce",
    "Power BI",
    "Excel"
  ],
  "summary_of_experience": {
    "years_minimum": 0,
    "years_maximum": 0,
    "months_minimum": 0,
    "months_maximum": 0
  },
  "raw_text": "SENIOR PERFORMANCE DATA ANALYST\n\nJob no: 511700\nWork type: Full Time - Permanent\nLocation: Gaydon, Warwickshire\nCategories: Commercial\n\nThe Opportunity\n\nJoin Aston Martin and drive the future of ultra luxury performance\n\nWe are seeking a forward-thinking Senior Performance Analyst to join our global network development and performance team to transform complex data into commercial insights across our global dealer network.  In this pivotal role you will turn complex performance data into clear actions that elevate network effectiveness, customer experience and commercial growth.\n\nThis is a rare opportunity to combine analytical excellence, commercial awareness, and automotive passion to influence how one of the world’s most iconic brand measures and drives performance.\n\n \n\nWhat You’ll Do\n\nAs a key member of the Network Development & Performance team, you’ll lead the evolution of how Aston Martin collects, analyses, and translates data into strategies that power growth and excellence.\n\nYou will:\n\nAnalyse global and regional dealer performance across sales, aftersales, standards, financial performance, and customer experience.\nBuild and enhance dashboards, scorecards, and visualisations using Tableau, Salesforce, and Power BI — creating clarity from complexity.\nAssess market performance, competitor activity, and vehicle parc trends to shape network strategy and decision-making.\nTranslate data into insights, and measurable plans that drive improvement.\nCollaborate with cross-functional teams to strengthen data integrity, reporting accuracy, and insight delivery.\nPresent analytical findings and performance insights to the senior leadership team that showcase the health and performance of the global network\nChampion a culture of data-led thinking, ensuring insights inform every key decision.\n\nYou’ll take ownership through three key phases:\n\nFoundation: Strengthen and streamline core reporting and data systems.\nEvaluation: Deepen insight through advanced analytics and trend analysis.\nTransformation: Turn insight into action, embedding performance excellence across the business.\n\n \n\nWhat You’ll Bring\n\nYou’re naturally curious with a high attention to detail, commercially minded, and confident using data to influence decision making.\n\nProven experience in commercial, performance, or data analytics — ideally within the automotive sector.\nStrong knowledge of Salesforce, Tableau, and Power BI for analysis and visualisation.\nAdvanced Excel skills (including macros).\nA degree in Data Analytics, Economics, Business, or a related discipline — or equivalent experience.\nA track record of improving data quality, governance, and insight delivery.\nExcellent communication skills — able to simplify complex data for diverse audiences.\nCollaborative, resilient, and unafraid to challenge ideas to drive progress.\n\n \n\nWhy Join Us\n\nAt Aston Martin, data doesn’t just measure performance — it fuels transformation.\n\nHere, precision meets passion. You’ll help turn numbers into narratives, insights into action, and performance into progress — all while shaping the future of one of the most iconic automotive brands in the world.\n\nJoin us, and be part of a team where your analysis helps drive excellence, innovation, and lasting impact."
}
