{
  "job_id": "apple_promotional_artwork_manager_london",
  "company": "Apple",
  "role": "Promotional Artwork Manager",
  "location": "London, England, United Kingdom",
  "seniority": "Mid-level",
  "responsibilities": [
    "Partner with external App Store developers worldwide to ensure artwork meets Apple’s creative standards and App Store guidelines.",
    "Oversee the full asset management lifecycle, from ingestion, review, and approval to handoff and archiving for large volumes of creative materials.",
    "Own end-to-end production of static and motion assets for iPhone, iPad, Apple Watch, and Apple TV, spanning always-on and high-profile campaigns.",
    "Manage, screen, and prepare developer-provided artwork for safe internal use, coordinating business and legal approvals as needed.",
    "Partner with global cross-functional teams (editorial, design, production, business management) to deliver engaging, high-quality work on tight deadlines.",
    "Contribute to shaping new tools and systems to improve creative workflows and asset delivery, in collaboration with operations and engineering teams.",
    "Maintain exceptional organisation, attention to detail, and proactive communication across time zones."
  ],
  "must_have_requirements": [
    "Strong background collaborating with global cross-functional teams across design, editorial, production, and engineering.",
    "Deep understanding of digital asset specifications, design principles, and App Store creative standards.",
    "Skilled in digital asset management systems and creative tools, including Box, Airtable, Adobe Photoshop, and Illustrator.",
    "Excellent project management, organisation, and communication skills, with the ability to meet tight and shifting deadlines."
  ],
  "nice_to_have_requirements": [
    "Experience coordinating business affairs and legal approvals for creative materials.",
    "Passion for technology, apps, and games, with a strong grasp of Apple platforms and user experience.",
    "Proactive problem-solver who thrives in fast-paced, detail-oriented environments.",
    "Fluency in English. Other languages beneficial."
  ],
  "skills": [
    {
      "skill": "Digital Asset Management",
      "importance": 8
    },
    {
      "skill": "Project Management",
      "importance": 8
    },
    {
      "skill": "Communication",
      "importance": 8
    },
    {
      "skill": "Box",
      "importance": 7
    },
    {
      "skill": "Airtable",
      "importance": 7
    },
    {
      "skill": "Adobe Photoshop",
      "importance": 7
    },
    {
      "skill": "Adobe Illustrator",
      "importance": 7
    },
    {
      "skill": "Design Principles",
      "importance": 7
    },
    {
      "skill": "Cross-functional Team Collaboration",
      "importance": 9
    }
  ],
  "tech_stack": [
    "Adobe Photoshop",
    "Adobe Illustrator",
    "Box",
    "Airtable"
  ],
  "min_years_experience": 0,
  "max_years_experience": 0,
  "years_experience_summary": {
    "digital_asset_management": 0,
    "project_management": 0,
    "communication": 0,
    "box": 0,
    "airtable": 0,
    "adobe_photoshop": 0,
    "adobe_illustrator": 0
  },
  "raw_text": "Promotional Artwork Manager | (EMEA) - Fixed-Term Contract\nLondon, England, United Kingdom\nSoftware and Services\n\nSummary\nApple is where individual imaginations gather together, committing to the values that lead to great work. Every new product we build, service we create, or Apple Store experience we \ndeliver is the result of us making each other’s ideas stronger. That happens because every one of us shares a belief that we can make something wonderful and share it with the world, changing lives for the better. It’s the diversity of our people and their thinking that inspires the innovation that runs through everything we do. When we bring everybody in, we can do the best work of our lives. Here, you’ll do more than join something — you’ll add something.\n\nThe App Store is the world's largest and most innovative software store, serving hundreds of millions of iPhone, iPad, Apple Watch, Vision Pro and Mac customers worldwide.\n\nWe have an exciting opportunity for a Promotional Artwork Manager to join the team and support creative content production. We are looking for someone with excellent communication, collaboration and project management skills to join our team on a contract. In this role you will help manage the promotional artwork programme for the App Store.\n\nDescription\nYou will be joining a dynamic digital production environment and will oversee the intake and approval of hundreds of developer assets submitted for promotional use on the App Store every month. The digital assets team is a key partner in the App Store ecosystem, and works closely with cross-functional teams including Design, Editorial, Production and Business Affairs to coordinate and deliver engaging promotions to our customers.\n\nYou will be responsible for carrying out the developer asset lifecycle from request through reviews and approvals to handoff and archiving. You will also be responsible for working cross-functionally with teams around the world to help shape plans for the asset management process and tooling enhancements.\n\nResponsibilities\nPartner with external App Store developers worldwide to ensure artwork meets Apple’s creative standards and App Store guidelines.\nOversee the full asset management lifecycle, from ingestion, review, and approval to handoff and archiving for large volumes of creative materials.\nOwn end-to-end production of static and motion assets for iPhone, iPad, Apple Watch, and Apple TV, spanning always-on and high-profile campaigns.\nManage, screen, and prepare developer-provided artwork for safe internal use, coordinating business and legal approvals as needed.\nPartner with global cross-functional teams (editorial, design, production, business management) to deliver engaging, high-quality work on tight deadlines.\nContribute to shaping new tools and systems to improve creative workflows and asset delivery, in collaboration with operations and engineering teams.\nMaintain exceptional organisation, attention to detail, and proactive communication across time zones.\nMinimum Qualifications\nStrong background collaborating with global cross-functional teams across design, editorial, production, and engineering.\nDeep understanding of digital asset specifications, design principles, and App Store creative standards.\nSkilled in digital asset management systems and creative tools, including Box, Airtable, Adobe Photoshop, and Illustrator.\nExcellent project management, organisation, and communication skills, with the ability to meet tight and shifting deadlines.\nPreferred Qualifications\nExperience coordinating business affairs and legal approvals for creative materials.\nPassion for technology, apps, and games, with a strong grasp of Apple platforms and user experience.\nProactive problem-solver who thrives in fast-paced, detail-oriented environments.\nFluency in English. Other languages beneficial."
}
