{
  "job_id": "rockstar_net_tools_programmer_edinburgh",
  "company": "Rockstar Games",
  "role": ".NET Tools Programmer",
  "location": "Edinburgh, Scotland",
  "seniority": "Mid-level",
  "responsibilities": [
    "Collaborate with producers and developers to build applications for game creation.",
    "Develop a strong understanding of existing systems and learn new technologies.",
    "Help define architecture, design patterns, and frameworks.",
    "Identify areas to improve user workflows and quality of life.",
    "Maintain applications through various stages of their lifecycle."
  ],
  "must_have_requirements": [
    "Degree in Computer Science, Mathematics or equivalent.",
    "Strong C#/.Net skills.",
    "Experience with a desktop UI development framework.",
    "Strong problem solving skills.",
    "Strong debugging skills.",
    "Excellent communication and teamwork skills.",
    "Ability to work within a schedule and deliver effectively to deadlines."
  ],
  "nice_to_have_requirements": [
    "Experience working with WPF, XAML and the MVVM pattern.",
    "Experience working with SQL/NoSQL databases.",
    "Experience writing applications that consume external services.",
    "Familiarity with one or more RPC frameworks such as WCF or gRPC.",
    "Familiarity with one or more ORM frameworks such as NHibernate or Entity Framework.",
    "Experience working with Docker.",
    "Experience with automation and CI/CD systems.",
    "Passion for technology and games, in-depth familiarity of Rockstar products."
  ],
  "skills": [
    {
      "skill": "C#",
      "importance": 9,
      "years_of_experience": 3
    },
    {
      "skill": ".NET",
      "importance": 9,
      "years_of_experience": 3
    },
    {
      "skill": "UI Development",
      "importance": 7,
      "years_of_experience": 1
    },
    {
      "skill": "Problem Solving",
      "importance": 8,
      "years_of_experience": 0
    },
    {
      "skill": "Debugging",
      "importance": 8,
      "years_of_experience": 0
    },
    {
      "skill": "Communication",
      "importance": 7,
      "years_of_experience": 0
    },
    {
      "skill": "Teamwork",
      "importance": 7,
      "years_of_experience": 0
    },
    {
      "skill": "WPF",
      "importance": 5,
      "years_of_experience": 0
    },
    {
      "skill": "XAML",
      "importance": 5,
      "years_of_experience": 0
    },
    {
      "skill": "MVVM",
      "importance": 5,
      "years_of_experience": 0
    },
    {
      "skill": "SQL",
      "importance": 4,
      "years_of_experience": 0
    },
    {
      "skill": "NoSQL",
      "importance": 4,
      "years_of_experience": 0
    },
    {
      "skill": "RPC",
      "importance": 3,
      "years_of_experience": 0
    },
    {
      "skill": "WCF",
      "importance": 3,
      "years_of_experience": 0
    },
    {
      "skill": "gRPC",
      "importance": 3,
      "years_of_experience": 0
    },
    {
      "skill": "ORM",
      "importance": 3,
      "years_of_experience": 0
    },
    {
      "skill": "NHibernate",
      "importance": 3,
      "years_of_experience": 0
    },
    {
      "skill": "Entity Framework",
      "importance": 3,
      "years_of_experience": 0
    },
    {
      "skill": "Docker",
      "importance": 4,
      "years_of_experience": 0
    },
    {
      "skill": "CI/CD",
      "importance": 4,
      "years_of_experience": 0
    }
  ],
  "tech_stack": [
    "C#",
    ".NET",
    "WPF",
    "XAML",
    "MVVM",
    "SQL",
    "NoSQL",
    "WCF",
    "gRPC",
    "NHibernate",
    "Entity Framework",
    "Docker",
    "CI/CD"
  ],
  "experience_summary": {
    "years_minimum": 3,
    "years_maximum": 7
  },
  "raw_text": ".NET Tools Programmer (Mid / Senior)\n\nAt Rockstar Games, we create world-class entertainment experiences. \n\nBecome part of a team working on some of the most rewarding, large-scale creative projects to be found in any entertainment medium - all within an inclusive, highly-motivated environment where you can learn and collaborate with some of the most talented people in the industry. \n\nRockstar is on the lookout for a passionate .NET Tools Programmer who possess an enthusiasm for Tools development.\n\nThis is a full-time, permanent and in-office position based in Rockstar’s state-of-the-art game development studio in Edinburgh, Scotland. \n\nWHAT WE DO\nThe Rockstar Games Tools Team create and maintain software tools that are used by all game development disciplines to support the creation of all Rockstar Games projects.\nThese software tools range from digital content exporters, a data processing asset pipeline to game, CI/CD automation systems and UI editors.\nRESPONSIBILITIES\nCollaborate with producers and developers to build applications that enable the creation of Rockstar’s complex and ambitious games.\nDevelop a strong understanding of the systems we use and learn new technologies to help advance our applications.\nHelp define architecture, design patterns and frameworks to improve how we build applications.\nIdentify areas to improve user workflows and quality of life.\nMaintain applications through various stages of their lifecycle.\nREQUIREMENTS\nA degree in Computer Science, Mathematics or equivalent.\nStrong C#/.Net skills.\nExperience with a desktop UI development framework.\nStrong problem solving skills.\nStrong debugging skills.\nExcellent communication and teamwork skills.\nAbility to work within a schedule and deliver effectively to deadlines.\nPLUSES\n\nPlease note that these are desirable skills and are not required to apply for the position.\n\nExperience working with WPF, XAML and the MVVM pattern.\nExperience working with SQL/NoSQL databases.\nExperience writing applications that consume external services.\nFamiliarity with one or more RPC frameworks such as WCF or gRPC.\nFamiliarity with one or more ORM frameworks such as NHibernate or Entity Framework.\nExperience working with Docker.\nExperience with automation and CI/CD systems.\nPassion for technology and games, in-depth familiarity of Rockstar products is a massive plus.\nHOW TO APPLY\n\nPlease apply with a CV and cover letter demonstrating how you meet the skills above. If we would like to move forward with your application, a Rockstar recruiter will reach out to you to explain next steps and guide you through the process."
}
